"The electrically-powered ceiling fan was invented in 1882 by Philip Diehl.",
"The elephant is one of the few mammals that can''t jump!",
"The energy of a discharge of an electric eel could start 50 cars.",
"The estimated number of M&M''s sold each day in the United States is 200,000,000.",
"The face of a penny can hold about thirty drops of water.",
"The famous aphrodisiac ''Spanish Fly'' is made from dried beetle remains!",
"The faster a kangaroo hops, the less energy it burns!",
"The fastest moving land snake is the Black Mamba which can move up to 7 miles per hour.",
"The fastest speed a falling raindrop can hit you is 18mph.",
"The fear of animals is called Zoophobia.",
"The female pigeon cannot lay eggs if she is alone. In order for her ovaries to function, she must be able to see another pigeon.",
"The filming of the movie ''Titanic'' cost more than the Titanic itself!",
"The fingerprints of koala bears are virtually indistinguishable from those of humans, so much so that they could be confused at a crime scene.",
"The first alarm clock could only ring at 4 a.m.",
"The first American chess tournament was held in New York in 184",
"The first baseball caps were made of straw.",
"The first bomb dropped by the Allies on berlin in WW2 killed the only elephant in the Berlin Zoo.",
"The first bomb dropped on Germany in WWII killed the only elephant in the Berlin zoo!",
"The first bowler to take 10 wickets in a Test innings was Jim Laker in 195",
"The first coast-to-coast telephone line was established in 191",
"The first domain name ever registered was Symbolics.com.",
"The first ever dam and reservoir for irrigation purposes was built in Saurashtra.",
"The first ever patent in the UK was Aaron Rathbone & Roger Burges, Map makers in 1618!",
"The first Ford cars had Dodge engines.",
"The first hard drive available for the Apple II had a capacity of only 5 megabytes.",
"The first Harley Davidson motorcycle was built in 1903 and used a tomato can for a carburetor.",
"The first household refrigerators cost about $16,000, in today''s money!",
"The first OSCAR awards were presented on May 16 1929 at the Hollywood Roosevelt Hotel with an audience of about 26 people.",
"The first person to go over Niagara falls was Annie Edson-Taylor. She made the trip in a wooden barrel and survived!",
"The first product that Sony came out with was the rice cooker.",
"The first product that the toy company Mattel came out with was picture frames.",
"The first product to have a bar code was Wrigleys gum!",
"The first programme shown on BBC2 was Play School",
"The first railway line in india was opened to traffic between 'Mumbai and Thane' (Maharashtra).",
"The first song played on Virgin Radio was Born to be wild by INXS!",
"The first telephone book was one page long and had only 50 names in it.",
"The first toilet being flushed in a motion picture was in the movie Psycho.",
"The first TV commercial showed a Bulova watch ticking onscreen for exactly 60 seconds.",
"The first two years of a dog''s life are equal to 24 human years.",
"The First Wireless TV Remote was invented by 'Eugene Polley' in 195",
"The flea can jump 350 times its body length, that is like a human jumping the length of a football field.",
"The four religions born in India Hinduism Buddhism Jainism and Sikhism are followed by 25% of the world's population.",
"The G in ''g-string'' stand for groin.",
"The game of snakes & ladders was created by the 13th century poet saint Gyandev.",
"The game of volleyball was invented in 1895 by William G. Morgan.",
"The Giant South African Earthworm can grow up to 22 feet long and 1 inch in thick.",
"The giant squid has the largest eyes in the world.",
"The glue on Israeli stamps is certified kosher.",
"The Grateful Dead were once called ''The Warlocks''.",
"The great wall of China is 1,400 miles long!",
"The Greek National anthem has 158 verses!",
"The hair of an adult man or woman can stretch 25 percent of its length without breaking.",
"The heart of a mouse beats 650 times per minute!",
"The heart of an astronaut actually gets smaller when in outer space.",
"The heart pumps about 1 million barrels of blood during an average lifetime!",
"The height of a bowling pin is equal to its circumference.",
"The higher the income, the more likely an American man will cheat on his wife.",
"The highest attendance for one football match was in the 1950 final. The official attendance was 199854 for the match between Brazil and Uruguay.",
"The highest point in Pennsylvania is lower than the lowest point in Colorado!",
"The highest speed ever achieved on a bicycle is 26831 kmph (1694mph) by Fred Rompelberg. (Record date: 3 October 1995)",
"The Honourable Company of Edinburgh Golfers founded in 1744, is the world''s oldest golf club!",
"The household wrench was invented by boxing heavyweight champion Jack Johnson in 1922.",
"The human body contains 96000km(59650miles) of blood vessels.",
"The human brain is insensitive to pain.",
"The human heart creates enough pressure to squirt blood 30 ft.",
"The human heart creates enough pressure while pumping to squirt blood 30 feet.",
"The Indian economy is the world's eleventh largest economy by nominal GDP and the fourth largest by purchasing power parity.",
"The inventor of the Waffle Iron did not like waffles.",
"The inventor of Vaseline ate a spoonful of the stuff every morning!",
"The IRS employees tax manual has instructions for collecting taxes after a nuclear war.",
"The IRS processes more than 2 billion pieces of paper each year.",
"The Japanese call their country as 'Nippon'.",
"The Japanese commonly put ketchup on their rice.",
"The Japanese liquor, Mam, uses venomous snakes as one of its main engredients.",
"The katydid bug hears through holes in its hind legs!",
"The king of hearts is the only king without a moustache on a standard playing card!",
"The Knock Nevis was a massive ship with '1504' ft length last used as a floating storage and offloading unit (FSO)",
"The Koala bear is not really a bear but is really related to the kangaroo and the wombat.",
"The largest diamond ever found was an astounding 3,106 carats!",
"The largest recorded tsunami was a wave 1720 feet (524 meters) above sea level in Lituya Bay Alaska (July 9 1958)",
"The last time American Green cards were actually green was 1964.",
"The launching mechanism of a carrier ship that helps planes to take off could throw a pickup truck over a mile.",
"The leading cause of poisoning for children under the age of six in the home is liquid dish soap.",
"The lense of the eye continues to grow throughout a person''s life.",
"The life boat was patented in 1845!",
"The lifespan of the common goldfish is over 20 years!",
"The lion that roars in the MGM logo is named Volney.",
"The liquid inside young coconuts can be used as a substitute for blood plasma.",
"The little bags of netting for gas lanterns (called ''mantles'') are radioactive...so much so that they will set of an alarm at a nuclear reactor.",
"The longest cave in the world is the ''Mammoth Cave System'' in the USA at 560,000 mtrs deep!",
"The longest professional tennis match was between Nicolas Mahut and John Isner on June 22 23 and 24 2010. It lasted 183 games and required 11 hours and 5 minutes of playing time.",
"The longest recorded flight of a chicken is 13 seconds!",
"The longest tournament chess game (in terms of moves) ever to be played was Nikolic - Arsovic Belgrade 1989 which lasted for 269 moves and took 20 hours and 15 minutes to complete a drawn game.",
"The longest word in the English language is pneumonoultramicroscopicsilicovolcanoconioses!",
"The longest word in the English language with no vowels is Rhythms!",
"The Lucky Dog (1921) is the first film to include both members 'Stan Laurel' and 'Oliver Hardy' later known as Laurel and Hardy.",
"The lungfish can live out of water for three years in a state of suspended animation.",
"The major air-polluting industries are iron steel and cement.",
"The male gypsy moth can smell the virgin female gypsy moth from 1.8 miles away!",
"The male platypus has poisonous spurs on its legs.",
"The man who created the Thighmaster was once a Bhuddist Monk.",
"The mask used by Michael Myers in the original ''Halloween'' was actually a Captain Kirk mask painted white.",
"The metal instrument used in shoe stores to measure feet is called the Brannock device.",
"The MGM Grand Hotel of Las Vegas washes 15,000 pillowcases per day!",
"The mile is Latin for 1,000. The number of paces it took the average Roman!",
"The Mint once considered producing doughnut-shaped coins!",
"The Mona Lisa has no eyebrows. It was the fashion in Renaissance Florence to shave them off!",
"The moon is actually moving away from Earth at a rate of 1.5 inches per year.",
"The most collect calls are made on Father''s Day.",
"The most common time for a bank robbery is Friday, between 9 and 11 a.m.  The least likely time is Wednesday, between 3 and 6 p.m.",
"The most dangerous job in the United States is that of an Alaskan Crab Fisherman.",
"The most poisonous lizard is 'Gila monster'.",
"The most popular Campbell''s Soup in Hong Kong is watercress and duck gizzard.",
"The most popular first name in the world is Muhammad!",
"The most popular sport as a topic for a film is boxing.",
"The most powerful electric eel is found in the rivers of Brazil, Columbia, Venezuela, and Peru, and produces a shock of 400-650 volts.",
"The most productive day of the workweek is Tuesday.",
"The most pushups ever performed in one day was 46,001.",
"The most used letter in the English alphabet is ''E'', and ''Q'' is the least used!",
"The mother of the boy Michael Jackson is accused of abusing him as Janet Jackson.",
"The Muppet Show was banned from Saudi Arabian TV becuase one if its stars was a pig.",
"The name `India' is derived from the River Indus.",
"The name Joshua is Hebrew for Jesus.",
"The name Wendy was made up for the book Peter Pan!",
"The name Wendy was made up for the book Peter Pan.",
"The National Flag of India was adopted in its present form during a meeting of the Constituent Assembly held on 22 July 1947 when it became the official flag of the Dominion of India.",
"The Nestles haven''t run Nestle since 1875.",
"The New York Stock Exchange started as a coffee shop!",
"The Niagara Falls moves upstream at an average rate of about 295ft a century!",
"The Nobel Peace Prize medal depicts 3 naked men with their hands on each others shoulders.",
"The noble gas Xenon lasers can cut through materials that are so tough even diamond tipped blades will not cut.",
"The normal static electricty shock that zaps your finger when you touch a doorknob is usually between 10,000 and 30,000 volts!",
"The number of births that occur in India each year is higher than the entire population of Australia.",
"The oceans cover 71% of the Earth's surface and contain 97% of the Earth's water.",
"The octopus'' testicles are located in its head.",
"The odds of being killed by falling out of bed are one in two million.",
"The odds of getting a hole-in-one in golf are estimated at about 18,000-to-1.",
"The oil used by jewelers to lubricate clocks and watches costs about $3,000 a gallon.",
"The oldest patented company logo is the red triangle of Bass beers!",
"The oldest pig in the world lived to the age of 68.",
"The only 15 letter word that can be spelled without repeating a letter is uncopyrightable!",
"The only confirmed poisonous bird in the world is 'Hooded Pitohui' of Papua New Guinea. The poison is found in its skin and feathers.",
"The only country in the world with 13 months is Ethiopia.",
"The only fish which can able to fly is Exocoetidae.",
"The only food that cockroaches wont eat are Cucumbers!",
"The only king without a moustache in a deck of cards is the king of hearts.",
"The only part of the body that has no blood supply is the cornea in the eye. It takes in oxygen directly from the air.",
"The opposite sides of a dice cube always add up to seven!",
"The original name for the butterfly was ''flutterby''!",
"The original title of Jane Austen''s novel Pride and Prejudice was First Impression!",
"The original Toby jugs were modelled on Harry ''Toby'' Elwes a Yorkshireman!",
"The owl is the only bird to drop its upper eyelid to wink. All other birds raise their lower eyelids.",
"The Pacific island of Nauru’s economy is almost entirely based on bird droppings.",
"The penalty for masturbation in Indonesia is decapitation.",
"The penguin is the only bird that can swim, but cannot fly.",
"The penis of a barnacle may reach up to 20 times its body size!",
"The phrase ''rule of thumb'' is derived from and old English law which stated that you couldn''t beat your wife with anything wider than your thumb.",
"The Pittsburgh Steelers were originally called the Pirates.",
"The placement of a donkey''s eyes in its head enables it to see all four feet at all times!",
"The placement of a donkey''s eyes in its'' heads enables it to see all four feet at all times.",
"The poison-arrow frog has enough poison to kill about 2,200 people!",
"The population of the Earth has more than doubled since 1950.",
"The powder on chewing gum is finely-ground marble.",
"The practice of identifying baseball players by number was started by the Yankees in 1929.",
"The praying mantis is the only insect that can turn its head!",
"The pupil of the eye expands as much as 45 percent when a person looks at something pleasing.",
"The Queen Mary - the grandest vessel of her day - had many of her vital components made by car manufacturer Skoda!",
"The quills of a porcupine are soft when they are born.",
"The race number 46 has been ever present in Valentino Rossi's career uses same number as his father Graziano ran with during his own Moto GP career.",
"The revenue that is generated from gambling is more than the revenue that comes from movies, cruise ships, recorded music, theme parks, and spectator sports combined.",
"The right lung takes in more air than the left.",
"The right lung takes in more air than the left.",
"The roar that we hear when we place a seashell next to our ear is not the ocean but rather the sound of blood surging through the veins in the ear.",
"The Saguaro Cactus, found in South-western United States does NOT grow branches until it is 75 years old.",
"The scientific name for the domestic dog is 'Canis lupis familiaris'.",
"The scientific name of human being's is HOMO SAPIENS.",
"The Scientifical name of 'Tiger' is 'Panthera tigris'.",
"The search engine Google got its name from the word ‘googol’, which refers to the number one with a hundred zeros after it.",
"The seeds of an Indian Lotus tree remain viable for 300 to 400 years.",
"The sentence The quick brown fox jumps over a lazy dog uses every letter of the alphabet!",
"The skeleton of a spider is located on the outside of the body. The name for this is exoskelton.",
"The sloth (a mammal) moves so slowly that green algae can grow undisturbed on its fur!",
"The smallest human penis ever recorded was just 5/8 of an inch long!",
"The smallest man ever was Gul Mohammed (1957-1997) of India who measured 1 feet 10? inches.",
"The song ''Strawberry Fields Forever'', sung by the Beatles, refers to an orphanage located in Liverpool.",
"The song 'Mile Sur Mera Tumhara' was composed by Ashok Patki and written by Piyush Pandey and was telecast for the first time on Independence Day 1988 in Doordarshan.",
"The sound made by a 'Deer' is called 'Bell'.",
"The sound made by a 'Elephant' is called 'Trumpet'.",
"The sound made by a 'Lion' is called 'Roar'.",
"The sound made by a 'Peacock' is called 'Scream'.",
"The sound made by a 'Snake' is called 'Hiss'.",
"The speed of a typical raindrop is 17 miles per hour.",
"The speed of sound in water is 1435 m/sec - nearly five times faster than the speed of sound in air.",
"The Stanley Cup originally was only seven and a half inches high.",
"The starfish is one of the few animals who can turn it''s stomach inside-out!",
"The state of Florida is bigger than England!",
"The state of Wyoming is named after a valley in Pennsylvania.",
"The state sport of Maryland is Jousting.",
"The state with the longest coastline in the Continental U.S. is Michigan.",
"The sting from a killer bee contains less venom than the sting from a regular bee!",
"The storage capacity of human brain exceeds 4 Terrabytes.",
"The streets of Victor, Colorado, once a gold rush town, are paved with low-grade gold.",
"The Summy Company registered 'Happy Birthday to You' song for copyright in 1935 crediting authors Preston Ware Orem and Mrs. R.R. Forman.",
"The sun is 330,330 times larger than the earth!",
"The sun is 330,330 times larger than the earth.",
"The sun is approximately 149 million kilometres from the earth.",
"The Swell Shark found in New Zealand barks like a dog.",
"The symbol on the ''pound'' key (#) is called an octothorpe.",
"The Taj Mahal took 20 years and 20 thousand men to finish!",
"The temperature of milk when it leaves the body of a cow is 101 degrees Fahrenheit. The milk is then quickly chilled and stored at a temperature of 40 degrees Fahrenheit.",
"The temperature of the earth''s interior increases by 1 degree every 60 feet down.",
"The three wealthiest families in the world have more assets than the combined wealth of the forty-eight poorest nations.",
"The tongue is the strongest muscle in the human body.",
"The two planes crashed in Twin towers are \"Q33 NY (Flight 11)\"and 'Flight 77'.(More interesting Type \"Q33 NY\"in Ms-Word with font size 48 and font name as 'WINGDINGS'and hit 'Enter' key).",
"The typical spec of dust that you see floating in the air is half way in size between the Earth and a subatomic particle.",
"The U.N.O headquarters is located at Geneva.",
"The U.S. Army accidentally ordered an 82 year supply of freeze-dried tuna salad mix for troops in Europe.",
"The U.S. army packs Tabasco pepper sauce in every ration kit that they give to soldiers.",
"The U.S. eastern seaboard consumes almost 50% of all ice cream sandwiches.",
"The U.S. founding fathers'' name for the American Revolution was ''The War with Britain''.",
"The U.S. Government spent $277,000 on pickle research in 1993.",
"The U.S. Government will not allow portraits of living persons to appear on stamps.",
"The U.S. has more bagpipe bands than Scotland does.",
"The U.S. military’s dried food rations can be re-hydrated with urine!",
"The U.S. motto, ''In God We Trust'', was not adopted as the national slogan until 1956.",
"The United kingdom eats more cans of baked beans than the rest of the world combined.",
"The United States consumes 25% of all the world’s energy.",
"The United States has never lost a war when donkeys were used.",
"The United States has the highest minimum drinking age in the world.",
"The United States Postal Service handles over forty percent of the world''s mail volume.",
"The United States produces enough plastic film annually to cover the entire state of Texas.",
"The United States produces more tobacco than it does wheat.",
"The universally popular Hershey bar was used overseas during World War II as currency.",
"The University of Alaska stretches over 4 time zones.",
"The US flag has 13 stripes (Red & White) representing the original 13 states.",
"The US government is building a supercomputer (Sequoia) for its nuclear department.",
"The Vandalur Zoo in Chennai is the First Zoo (1855) in India and one of the largest in South Asia.",
"The venom of a small scorpion is much more toxic than the venom of a large scorpion.",
"The venom of the king cobra is so deadly that just one gram of it can kill 150 people.",
"The very first motorcycle was made by Sylvester Howard roper in 186",
"The volume of the Earth''s moon is the same as the volume of the Pacific Ocean.",
"The wandering albatross is the bird with the biggest wingspan reaching up to 3 metres and weigh between 6 and 16 kg.",
"The warmest temperature ever recorded on Antarctica was 3 degrees F.",
"The WD in WD-40 stands for Water Displacer.",
"The weight of a carat (200 milligrams), standard unit of measurement for gemstones, is based on the weight of the carob seed.",
"The weight of air in a milk glass is about the same as the weight of one aspirin tablet.",
"The wheelbarrow is invented in China",
"The Wild Turkey is the only bird with a beard.",
"The winter of 1932 in the US was so cold that Niagara falls froze completely solid!",
"The word ''gymnasium'' comes from the Greek word gymnazein which means ''to exercise naked.",
"The word ''Indiana'' is Native American for ''Land of the Indians'', yet less than 16,000 Native Americans live there.",
"The word ''News'' is actually an acronym standing for the 4 cardinal compass points - North, East, West, and South!",
"The word ''set'' has more definitions than any other word in the English language.",
"The word 'News' is actually an acronym standing for the 4 cardinal compass points - North East West and South!",
"The word \"diamond\"comes from the Greek word \"adamas\"which means \"unconquerable.\"",
"The word taxi is spelled the same in English, German, French, Swedish and Portuguese.",
"The word Tips is actually an acronym standing for ''To Insure Prompt Service''.",
"The World Trade Center towers used to have two zip codes, 10047-10048, one for each building.",
"The world''s smallest mammal is the bumblebee bat of Thailand, weighing less than a penny.",
"The world''s termites outweigh the world''s humans 10 to 1!",
"The world's biggest library is the Library of Congress the national library of the United States.",
"The world's first roller coaster opened in 1884 at Coney Island New York.",
"The world's highest cricket ground is in Chail Himachal Pradesh located at an altitude of 7500 feet above sea-level.",
"The world's tallest woman is Sandy Allen (USA). She was 35m (7 ft. 7 in.).",
"The worlds oldest piece of chewing gum is over 9000 years old!",
"The worlds smallest bird is the 'bee hummingbird' found in Cuba.",
"The world’s youngest parents were 8 and 9 and lived in China in 1910.",
"The Yo-Yo originated as a weapon in the Philippine Islands during the sixteenth century.",
"The youngest person to climb Mount Everest was 13-year-old Jordan Romero in 22' May 201",
"The Zip Code 12345 is assigned to General Electric in Schenectady, New York.",
"The ‘Big Dipper’ is known as ‘The Casserole’ in France.",
"The ‘v’ in the name of a court case does not stand for ‘versus’ but for ‘and’ (in civil proceedings) or ‘against’ (in criminal proceedings).",
"There are 10 towns named Hollywood in the United States!",
"There are 10 towns named Hollywood in the United States.",
"There are 102 floors in Empire State building New York City.",
"There are 206 bones in the human body!",
"There are 293 ways to make change for a dollar.",
"There are 365 steps on the front of the U.S. Capitol Building - one for every day of the year.",
"There are 53 Lego bricks manufactured for each person in the world.",
"There are 635,013,559,599 possible hands in a game of bridge.",
"There are 70 million sheep in New Zealand (with 4 million people)",
"There are 92 known cases of nuclear bombs lost at sea.",
"There are approximately 3,500 astronomers in the U.S. - but over 15,000 astrologers.",
"There are currently 6912 living languages defined as languages that people speak today.",
"There are more bacteria in your mouth than there are people in the world.",
"There are more fatal car accidents in July than any other month.",
"There are more female than male millionaires in the United States.",
"There are more insects in one square mile of rural land than there are human beings in the world.",
"There are more nutrients in the cornflake package itself than there are in the actual cornflakes.",
"There are more plastic flamingos in the U.S, than real ones!",
"There are more species of fish than all the species of amphibians reptiles birds and mammals combined.",
"There are more telephones than people in Washington, D.C.",
"There are more than 1,000 chemicals in a cup of coffee. Of these, only 26 have been tested, and half caused cancer in rats.",
"There are more than 10 million bricks in the Empire State Building!",
"There are more than 50,000 earthquakes throughout the world every year!",
"There are more than one million animal species on Earth!",
"There are no ants in Iceland, Antarctica, and Greenland.",
"There are no clocks in Las Vegas gambling casinos.",
"There are no hog lips or snouts in SPAM.",
"There are no penguins in the North Pole.",
"There are no rental cars in Bermuda.",
"There are no words in the dictionary that rhyme with: orange, purple, and month! Interesting tries from our readers: orange: door hinge, melange (French for mix) purple: hurtle, durple?, turtle month: once, bunth?, hunch",
"There are only 14 blimps in the world.",
"There are over 130 species of owl.",
"There are over 58 million dogs in the U.S!",
"There are over 7000 different types of apples.",
"There are roughly 144000 mosquitoes for every person on earth.",
"There are some species of snails that are extremely venomous.",
"There are three golf balls sitting on the moon.",
"There are two independent states within Italy: the Republic of San Marino (25 square miles) and the Vatican City (just 107 acres)",
"There are two kinds of camels 'Arabian' with one humps (lives in Western Asia and Northern Africa) and 'Bactrian' with two humps (lives in Mongolia and Chinese Turkistan.)",
"There have been 47 Charlie Chan Movies, with six actors playing the part.  None were Chinese!",
"There have been over 7,200 acts of terrorism against the US over the last 15 years.",
"There is a city called Rome on every continent.",
"There is a giant mushroom in Oregon that is over 2,400 years old, covers 3.4 square miles of land, and is still growing!",
"There is a species of clam that can grow up to four feet long and weigh up to 500 pounds.",
