"In 1998, Sony accidently sold 700,000 camcorders that had the technology to see through people''s clothes.",
"In 1999, Pepsi, Inc. paid $0.00 in income tax!",
"In 2003, the U.S. Government spent about $2,000,000.00 on potato research!",
"In 2004, The Japanese Ice Cream Association promoted “raw horse flesh” ice cream in hopes that it would boost the popularity of ice cream!",
"In 21 U.S. states, WALMART is the single largest employer.",
"In 32 years. there are about 1 billion seconds!",
"In 39 of the 50 U.S. states, the travel industry is the largest single employer.",
"In a year approximately 900 million trees are cut down to make the raw materials needed for American pulp mills and paper.",
"In a year, the average person walks four miles to make his or her bed.",
"In Albania, nodding your head means ''no'' and shaking your head means ''yes''.",
"In an average hour, there are over 61,000 Americans airborne over the United States.",
"In an average lifetime a person will walk the equivalent of three times around the world.",
"In ancient China, people committed suicide by eating a pound of salt.",
"In Ancient Greece, if a woman watched even one Olympic event, she was executed.",
"In ancient Japan, public contests were held to see who could fart the loudest and longest!",
"In ancient Rome it was considered a sign of leadership to be born with a crooked nose!",
"In ancient Rome it was considerfed a sign of leadership to be born with a crooked nose.",
"In Athens, Greece, a driver''s license can be taken away by law if the driver is deemed either unbathed or poorly dressed.",
"In Australia, Burger King is called Hungry Jack''s.",
"In Bangladesh, kids as young as 15 can be jailed for cheating on their finals!",
"In Belgium there is a museum just for strawberries.",
"In Brazil, Christmas is celebrated with fireworks.",
"In Cleveland, Ohio it is illegal to catch mice without a hunting license.",
"In England, in the 1880''s, Pants was considered a dirty word!",
"In England, the Speaker of the House is not allowed to speak.",
"In Florida, It is illegal to sing in a public place while attired in a swimsuit.",
"In Florida, Penalty for horse theft is death by hanging.",
"In France, it is legal to marry a dead person!",
"In Gulliver''s Travels Jonathan Swift described the two moons of Mars, Phobos and Deimos, giving their exact size and speeds of rotation. He did this more that a hundred years before either moon was discovered!",
"In Haiti, only 1 out of every 200 people own a car.",
"In high school, Robin Williams was voted ''Least Likely to Succeed.",
"In Holland, you can be fined for not using a shopping basket at a grocery store!",
"In Idaho, You may not fish on a camel''s back.",
"In India the number of motorized vehicles have increased from 2 million in 1947 to 33 million in 199",
"In India, Pajamas are accepted as standard daytime wearing apparel.",
"In India, people are legally allowed to marry a dog!",
"In India, pickled ginger, minced mutton, and a cottage cheese like substance are popular pizza toppings.",
"In its ancient form, the carrot was purple, not orange.",
"In just about every species of mammal, the female lives longer than the male.",
"In Kentucky, 50% of the people who get married for the first time are teenagers.",
"In Kentucky, it is illegal to carry ice-cream in your back pocket.",
"In Kentucky, It''s illegal to fish in the Ohio River in Kentucky without an Indiana Fishing License.",
"In many countries, urine was used as a detergent for washing.",
"In Massachusetts, It is illegal to go to bed without first having a full bath.",
"In Mel Brooks'' ''Silent Movie,'' mime Marcel Marceau is the only person who has a speaking role.",
"In Mexico, the Tooth Fairy is known as the ''Tooth Mouse''.",
"In most advertisements, the time displayed on a watch or clock is usually 10:10.",
"In Natoma, Kansas, it''s illegal to throw knives at men wearing striped suits",
"In Nebraska, It is illegal for bar owners to sell beer unless they are simultaneously brewing a kettle of soup.",
"In Nepal, cow dung is used for medicinal purposes.",
"In New York City, approximately 1,600 people are bitten by other humans every year.",
"In older people, memory is best early in the morning and then declines during the late afternoon.",
"In one day an average person will take about 18,000 steps.",
"In one day, a full grown redwood tree expels more than 2 tons of water through its leaves.",
"In Pakistan, goats are often sacrificed to improve the performance of the stock market.",
"In San Salvador, drunk drivers can be punished by death before a firing squad.",
"In Singapore, it is illegal to sell or own chewing gum.",
"In some parts of England, rum is used to wash a baby''s head for good luck.",
"In space, astronauts cannot cry properly, because there is no gravity, so the tears can''t flow down their faces!",
"In Spain, it is common to pour chocolate milk on cereal for breakfast.",
"In ten minutes, a hurricane releases more energy than all the world''s nuclear weapons combined!",
"In the 1930''s, American track star Jesse Owens used to race against horses and dogs to earn a living.",
"In the average lifetime a person will breath in about 44 pounds of dust.",
"In the early 1960''s, Porsche commercially manufactured farm tractors.",
"In the great fire of London, in 1666, half of London was burnt down but only 6 people were injured.",
"In the last 4,000 years, no new animals have been domesticated.",
"In the movie ''The Wizard Of Oz'', Toto the dog''s salary was $125 a week, while Judy Garland was $500 a week.",
"In the next seven days, 800 Americans will be injured by their jewelry.",
"In the original version of Cinderella the slipper was made out of fur, not glass!",
"In the U.S., for every dollar you spend on gasoline 27 cents of it is in taxes.",
"In the U.S., more than 10% of lottery prizes go unclaimed!",
"In the United States, deaf people have safer driving records than hearing people!",
"In the White House, there are 13,092 knives, forks and spoons!",
"In the year 2000, Pope John Paul II was named an Honorary Harlem Globetrotter!",
"In Tibet it is considered good manners to stick out your tongue at someone.",
"In Tokyo, a bicycle is faster than a car for most trips of less than 50 minutes!",
"In Tokyo, they sell toupees for dogs!",
"In total our Indian hockey team has won eight Olympics gold medals. (1928 to 1956 - remained unbeaten in the Olympics)",
"In West Virginia if you run over an animal, you can legally take it home and cook it for dinner!",
"In what country will you find the most Universities?  India.",
"India has a Bill of Rights for cows.",
"India hosted the Asian Games for the first time on March 4 1951 and it was held in New Delhi.",
"India invented the Number System. Zero was invented by Aryabhatta",
"India used to be the richest country in the world until the British invasion in the early 17th Century.",
"Indian national football team qualified for the 1950 World Cup finals in Brazil but could not appear as they still played bare feet at the time.",
"Indoor pollution is 10 times more toxic than outdoor pollution.",
"Infants spend more time dreaming than adults do.",
"Ingrown toenails are hereditary.",
"Instead of a birthday cake, many children in Russia are given a birthday pie.",
"Intelligent people have more zinc and copper in their hair.",
"International Business Machines is the expansion of 'IBM'.",
"Iron weighs more after it rusts.",
"Is bottled water worth it?  ''Evian'' spelled backwards is ''naive''.",
"Isaac Asimov is the only author to have a book in every Dewey-decimal category.",
"Israel is one quarter the size of the state of Maine.",
"Israel''s Dead Sea is 1,312 feet below sea level.",
"Istanbul, Turkey is the only city in the world located on two continents.",
"It costs about 3 cents to make a $1 bill in the United States.",
"It is estimated that at any one time, 0.7% of the world''s population are drunk.",
"It is estimated that millions of trees in the world are accidentally planted by squirrels who bury nuts and then forget where they hid them!",
"It is estimated that there is in excess of 3,000,000,000 bibles been sold throughout the world!",
"It is illegal for tourists to enter Mexico with more than 2 CD''s!",
"It is illegal NOT to smile in Pocatello, Idaho!",
"It is illegal to be a prostitute in Siena, Italy, if your name is Mary.",
"It is illegal to hunt camels in the state of Arizona.",
"It is illegal to mispronounce ''Arkansas'' while in the state of Arkansas!",
"It is illegal to purchase or consume Jack Daniel''s Whiskey in the town in which it is produced!",
"It is impossible to lick your elbow. (know you gonna try this...)",
"It is now possible to print human skin with an inkjet printer!",
"It is physically impossible for pigs to look up into the sky while they are standing.",
"It is physically impossible for pigs to look up into the sky.",
"It is possible for a scorpion to sting itself to death as they are not immune to their own poison!",
"It is possible to go blind from smoking too heavily.",
"It is possible to see a rainbow at night!",
"It snows more in the Grand Canyon than it does in Minneapolis, Minnesota.",
"It takes 100 pounds of rain water to produce a single pound of food from the earth.",
"It takes 17 muscles to smile, 43 to frown.",
"It takes 3,000 cows to supply the NFL with enough leather for a year''s supply of footballs.",
"It takes 40 minutes to hard boil an ostrich egg.",
"It takes 492 seconds for sunlight to reach the Earth!",
"It takes 70% less energy to produce a ton of paper from recycled paper than from trees.",
"It takes a drop of ocean water more than 1,000 years to circulate around the world.",
"It takes about 63,000 trees to make the newsprint for the average Sunday edition of The New York Times.",
"It takes about 8 minutes for light from the Sun to reach Earth.",
"It takes about a week to make a jelly bean.",
"It takes eight and a half minutes for light to get from the sun to earth.",
"It takes five minutes to execute someone in a gas chamber.",
"It takes Several hundred thousand years for newly made photons (light) to travel from the core of the sun to it''s surface.",
"It takes six months to build a Rolls Royce...and 13 hours to build a Toyota.",
"It takes the same amount of time to age a cigar as wine.",
"It takes twelve ears of corn to make a tablespoon of corn oil.",
"It takes up to four hours to hard boil an ostrich egg.",
"It took 20,000 men 22 years to build the Taj Mahal.",
"It took 38 years for radio to reach 50 million users 13 years for TV and only 5 years for the Internet.",
"It took Leo Tolstoy six years to write \"War & Peace\".",
"It was discovered on a space mission that a frog can throw up.",
"It was illegal to sell E.T. dolls in France because there is a law against selling dolls without human faces.",
"It was once against the law to have a pet dog in a city in Iceland!",
"It was once against the law to slam your car door in a city in Switzerland!",
"It would take twenty new mid-size cars to generate the same amount of pollution that a mid-size 1960''s car did.",
"It''s against the law to burp, or sneeze in a certain church in Omaha, Nebraska!",
"It''s against the law to pawn your dentures in Las Vegas!",
"It''s against the law to pawn your dentures in Las Vegas.",
"It''s illegal to own a red car in Shanghai, China.",
"It''s possible to lead a cow upstairs, but not downstairs.",
"Italy has over 3000 museums.",
"Italy is only country in FIFA world cup for the most matches with draw. (21 matches)",
"It’s a common practice in southern India for a man to marry his elder sister’s daughter.",
"J. Edgar Hoover liked to fire FBI agents whose palms were sweaty when shaking hands.",
"J.B Dunlop was first to put air into tires.",
"Jack Dorsey Evan Williams Biz Stone worked as a team and founded 'Twitter'. It was launched on July 15 200",
"Jackie chan's real name is 'Chan Kong-sang' and born on 7-April-1954 in Hong Kong.",
"Jackie Kennedy Onassis was secretly a chain smoker.",
"Jacksonville, Florida, has the largest total area of any city in the United States.",
"James Bond is also known as Mr. Kiss-Kiss-Bang-Bang.",
"Japan attacked Pearl Harbor that brought the United States into World War II.",
"Japan surrendered to USA on September 2 1945 (After Hiroshima & Nagasaki atomic bomb blasts)",
"Jean -Claude Van Damme learned to speak English by watching the cartoon ''The Flintstones.",
"Jennifer Aniston''s original name is Jennifer Anastassakis!",
"Jericho is the oldest walled city in the world at 9,000 yrs old!",
"Jimi Hendrix, Janis Joplin, and Jim Morrison were all 27 years old when they died.",
"Jimmy Carter is the first U.S. President to have been born in a hospital.",
"Jimmy Donal Wales is an American Internet entrepreneur and a co-founder and promoter of Wikipedia.",
"Jimmy Hoffa''s middle name is, appropriately, Riddle.",
"John F. Kennedy was buried without his brain after it was lost during the autopsy!",
"John F. Kennedy was the first Roman Catholic President of the USA!",
"Johnny Depp suffers from self-injury.",
"Jumbo jets use 4,000 gallons of fuel to take off .",
"Jupiter''s moon Ganymede, is larger than the planet Mercury!",
"Just one in three consumers pays off his or her credit card bill every month.",
"Justin Timberlake''s half-eaten french toast sold for over $3,000 on eBay!",
"Kamal Hassan holds the record for the most National Film Awards for an actor with four three awards for Best Actor and one for Best Child Artiste.",
"Karate actually originated in India, but was developed further in China.",
"Karoke means \"empty orchestra\"in Japanese.",
"Keanu Reeves is afraid of the dark.",
"Kermit the frog delivered the commencement address at Southampton College located in the state of New York in 1996.",
"Ketchup was sold in the 1830''s as medicine.",
"Kilts are not native to Scotland.  They originated in France.",
"King Fahd International Airport in Damman Saudi Arabia is one of the world's biggest airport with 780 square kilometres (larger than the nearby country of Bahrain).",
"King George I could not speak English!",
"King Kong was Adolf Hitler''s favorite movie.",
"Kite flying is a professional sport in Thailand.",
"Kite flying is a professional sport in Thailand.",
"Kittens are born both blind and deaf.",
"Kleenex tissues were originally used as filters in gas masks.",
"Koala Bears are not bears.",
"Kumar Ram Narain Karthikeyan was born on Jan 14 197",
"Kushang Sherpa (now an instructor with Himlayan Mountaineering Institute) is the only climber to climb all 4 sides of Mt. Everest.",
"Lake Nicaragua in Nicaragua is the only fresh water lake in the world that has sharks.",
"Large kangaroos can cover more than 30 feet with each jump!",
"Last 2 European countries to let women vote:  Switzerland (1971) and Leichtenstein (1984).",
"Leather skin does not have any smell. The leather smell that you sense is actually derived from the materials used in the tanning process.",
"Left-handed people are better at sports that require good spatial judgment and fast reaction, compared to right-handed individuals.",
"Lenny Kravitz''s mother played the part of ''Helen'' on ''The Jeffersons''.",
"Leonardo da Vinci invented scissors.",
"Leonardo Da Vinci invented the scissors.",
"Leonardo da Vinci was dyslexic, and he often wrote backwards.",
"Leonardo DiCaprio got his first ‘onscreen kiss’ from a man!",
"Less than 10% of criminals commit about 67% of all crime.",
"Less than 3% of the water produced at a large municipal water treatment plant is used for drinking purposes!",
"Lever Brothers India Limited was formed in 1933 and then renamed to “Hindustan Unilever Limited” in June 200",
"Lightning strikes about 6,000 times per minute on this planet!",
"Like fingerprints, everyone''s tongue print is different!",
"Lima beans contain cyanide!",
"Linen can absorb up to 20 times its weight in moisture before it feels damp!",
"Linen is actually stronger when wet.",
"Linux powers 446 of the world's top 500 supercomputers.",
"Lions in the wild usually makes no more than 20 kills a year.",
"Liquid TIDE laundry detergent glows under a blacklight.",
"Lizards use their tongues as sense organs. Lizards never stop growing.",
"London''s Pall Mall became the first street lit by gaslight in 1807!",
"Los Angeles''s full name is El Pueblo de Nuestra Senora la Reina de los Angeles de Porciuncula!",
"Louisiana is the only state that grows in land area every year (Due to alluvial deposits from the Mississippi River).",
"Maggots will only eat flesh if it is dead.  For this reason, they are often used to remove the burnt skin from severe burn patients.",
"Mahatma Gandhi was assassinated on 30 January 1948 shot at point-blank range by Nathuram Godse. (Succeeded on fifth attempt)",
"Mailing an entire building has been illegal in the U.S. since 1916 when a man mailed a 40,000-ton brick house across Utah to avoid high freight rates.",
"Malaysians protect their babies from disease by bathing them in beer.",
"Malcolm X''s original name is Malcolm Little.",
"Male hospital patients fall out of bed twice as often as female hospital patients.",
"Male monkeys lose the hair on their heads in the same way men do.",
"Males sweat 40% more than females.",
"Mammoths still walked the earth when the Great Pyramid was being built.",
"Manhattan Island of New York City was purchased for $24 from the Algonquian Indians in 1624!",
"Many people in parts of China eat insects. Some common insects are bean worms, scoprions, and locusts.",
"Marie Curie, the Nobel prize winning scientist who discovered radium, died of radiation poisoning.",
"Mark Twain didn''t even make it through elementary school.",
"Marlboro cigarettes sold in New York contain more tar and nicotine than those sold in all other states!",
"Martha Stewart became a billionaire while in prison.",
"Mathematical signs fact: 12+3-4+5+67+8+9100",
"McDonald''s is the world''s largest distributor of toys!",
"McDonald''s salads contain up to 60% more fat than their burgers!",
"Medical research has found substances in mistletoe that can slow down tumor growth.",
"Medical studies show that intelligent people have more copper and zinc in their hair.",
"Mel Blanc (the voice of Bugs Bunny) was allergic to carrots!",
"Mel Blanc (the voice of Bugs Bunny) was allergic to carrots.",
"Mel Blanc, the voice of Bugs Bunny, was allergic to carrots.",
"Mel Gibson has a horseshoe kidney (two kidneys fused into one)!",
"Members of the U.S. Congress are the world’s highest paid legislators.",
"Men are 6 times more likely to be struck by lightning than women!",
"Men are 6 times more likely to be struck by lightning than women.",
"Men laugh longer, louder, and more often than women.",
"Mercedes Benz company was founded in 1881 by 'Gottlieb Daimler' and 'Karl Benz'.",
"Mexican Jumping Beans jump because of moth larvae inside them.",
"Mexico City is built on top of an underground resevoir!",
"Mexico City is sinking at a rate of 18 inches per year!",
"Mexico has more American residents than any other country except the United States.",
"Mexico holds the record for most number of FIFA match loss. (22 matches)",
"Michael Jordan makes more money from Nike annually than all of the Nike factory workers in Malaysia combined.",
"Michael Jordan was cut from his high school basketball team his sophomore year.",
"Michael Joseph Jackson was born on August 29 1958 and died on June 25 200",
"Michael Keaton''s original name is Michael Douglas.",
"Microsoft made $16,005 in revenue in its first year of operation.",
"Midgets and dwarfs almost always have normal sized children.",
"Milk is heavier than cream.",
"Minnows have teeth in their throat.",
"Mohammed Azharruddin is the only player in the history of Test cricket to score a century in each of his first three test matches.",
"Mohandas Karamchand Gandhi'ji born on 2nd october 186",
"Mohanlal has received 10 National Award nominations in the Best Actor category. More nominations than any other actor.",
"Moist air holds heat better than dry air.",
"Monopoly is the most played board game in the world.",
"Months that begin on a Sunday will always have a ''Friday the 13th''.",
"More Americans have died in car accidents than have died in all the wars ever fought by the United States.",
"More boys than girls are born during the day; more girls are born at night.",
"More Monopoly money is printed in a year, than real money printed throughout the world!",
"More Monopoly money is printed in a year, than real money printed throughout the world.",
"More people are killed by donkeys annually than are killed in plane crashes.",
"More people have a phobia of frogs than rats.",
"More people have seen David Copperfield perform live than any other performer in the world.",
"More people in China speak English than in the United States.",
"More people use blue toothbrushes, than red ones!",
"More redheads are born in Scotland than in any other part of the world.",
"More steel in the United States is used to make bottle caps than to manufacture automobile bodies.",
"More than 10% of the world''s salt is used to de-ice American roads.",
"More than 100 pizza box-related patents have been issued since 1976!",
"More than 2,500 left handed people a year are killed from using products made for right handed people.",
"More than 20 million meteoroids enter Earth''s atmosphere every day.",
"More than 25% of the world''s forests are in Siberia.",
"More than 40,000 parasites and 250 types of bacteria are exchanged during a typical French kiss!",
"More than 400,000 U.S. houses still lack indoor plumbing.",
"More than 50% of Americans fall asleep on their sides.",
"More than 50% of the people in the world have never made or received a telephone call.",
"More than 6,000 people with pillow-related injuries check into U.S. emergency rooms every year!",
"More than 90% of shark attack victims survive.",
"More than half the population of Kenya is under the age of 15.",
"More than ten people a year are killed by vending machines.",
"Moscow weathermen can be fined for inaccurate weather forecasting!",
"Mosquitoes are attracted to the color blue twice as much as any other color.",
"Mosquitoes prefer children to adults, blondes to brunettes.",
"Most alcoholic beverages contain all 13 minerals necessary to sustain human life.",
"Most burglaries occur during the daytime!",
"Most cell phone antennas have no purpose other than to make people believe that flipping up a 2 inch antenna just gave them better reception. They are not connected to any circuitry.",
"Most dreams last only 5 to 20 minutes.",
"Most dust particles in your house are made from dead skin!",
"Most dust particles in your house come from dead skin.",
"Most lipstick contains fish scales!",
"Most lipstick contains fish scales.",
"Most liquid laundry detergents are alive with living organisms that help to break down stains!",
"Most NASCAR Teams use nitrogen in their tires instead of air.",
"Most of a hog''s sweat glands are in its snout.",
"Most of the world''s people must walk at least 3 hours to fetch water!",
"Most people who read the word ''yawning'' will yawn!",
"Most soccer players run 7 miles in a game.",
"Most tropical marine fish could survive in a tank filled with human blood.",
"Moths are not really attracted to light it fly towards the blackest point which is behind the light.",
"Motorists who talk on cell phones are more impaired than drunk drivers with blood-alcohol levels exceeding .08!",
"Mozilla Firefox was originally created by Dave Hyatt and Blake Ross as part of an experimental project.",
"Mr. Rogers was an ordained minister.",
"Muhammad is the most common name in the world.",
"Mukesh Ambani (Age:52) is now in 4th position in world's richest man table with $29 billion (USD)",
"Muralidharan's wickets list. Craig McDermott (1st) Stephen Fleming (100) Ben Hollioake (200) Shaun Pollock (300) Henry Olonga(400) Michael Kasprowicz (500) Khaled Mashud (600) Syed Rasel (700) Pragyan Ojha (800).",
"Murder is the only crime that does not increase during the full moon.  Theft, disorderly conduct, larceny, armed robbery, assault and battery, and rape all statistically increase dramatically during the full moon.",
"Mussolini dodged the Italian draft.",
"Nachos is the food most craved by pregnant women.",
"Names of the three wise monkeys are: Mizaru(See no evil) Mikazaru(Hear no evil) and Mazaru(Speak no evil)",
"Napoleon constructed his battle plans in a sandbox.",
"Napoleon had conquered Italy by the time he was twenty-six.",
"Native Americans do not have to pay tax on their land.",
"Natural gas has no smell.  The odor is artificially added so that people will be able to identify leaks and take measures to stop them.",
"Neanderthal man had a brain capcity 100cc larger than modern man''s.",
"Nearly 10% of American households dress their pets in Halloween costumes.",
"Nearly 22,000 checks will be deducted from the wrong account over the next hour.",
"Nearly 30% of female lottery winners hide their winning ticket in their bras.",
"Nearly 50% of the world’s scientists are assigned to military projects.",
"Nearly 80 percent of all sudden cardiac arrests happen at home.",
"Neither the saxophone, the tuba, the coronet, nor the valve trumpet existed before 1800.",
"Never hold your nose and cover your mouth when sneezing as it can blow out your eyeballs.",
"New York''s Central Park is nearly twice the size of the entire country of Monaco.",
"New Zealand is the first country to allow women to vote.",
"Next to Warsaw, Chicago has the largest Polish population in the world.",
"Nike Air Soles do not actually have ''air'' in them.",
"Ninety-nine percent of pumpkins sold in the United States are for the sole purpose of decoration.",
"No 2 cornflakes are identical!",
"No high jumper has ever been able to stay off the ground for more than one second.",
