"Blue Peter pet, Petra the mongrel puppy, died two days after being introduced. A replacement was found",
"Blueberry juice boosts memory.",
"Bluebirds cannot see the color blue.",
"Bob Hope and Billy Joel were both once boxers.",
"Boys who have unusual first names are more likely to have mental problems than boys with conventional names. Girls don''t seem to have this problem.",
"Brad Pitt has been smoking since the sixth grade!",
"Brazil is the only country to appear in every FIFA world Cup. (19 times)",
"Bruce lee (27-Nov-1940 to 20-July-1973) was the founder of the Jeet Kune Do martial arts movement.",
"Budget: $300000000",
"Budweiser beer is named after a town in Czechoslovakia.",
"Bulls are colorblind, therefore will usually charge at a matador''s waving cape no matter what color it is -- be it red or neon yellow!",
"Burj Khalifa (Arabic:\"Khalifa Tower\") known as Burj Dubai prior to its inauguration is a skyscraper in Dubai United Arab Emirates and the tallest man-made structure ever built at 828 m (2717 ft).",
"Burt Reynolds is a Cherokee Indian.",
"Business.com is currently the most expensive domain name sold for $7.5 million.",
"Butterflies taste with their feet.",
"Butterflies “smell” with their antennae and “taste” with their feet.",
"Buttermilk does not contain any butter.",
"By 3,000 B.C. there were at least six different types of beer in Egypt.",
"By feeding hens certain dyes they can be made to lay eggs with multi-colored yolks.",
"By partially filling saucers with vinegar and distributing the saucers around a room, you can eliminate odors.",
"By raising your legs slowly and laying on your back, you can''t sink in quicksand.",
"By recycling just one glass bottle, the amount of energy that is being saved is enough to light a 100 watt bulb for four hours.",
"By the age of 17 Bill Gates had sold his first computer program a time-tabling system for his high school for $420",
"By the age of 60, most people have lost 50% of their taste buds.",
"C3PO is the first character to speak in Star Wars.",
"California has issued at least 6 drivers licenses to people named Jesus Christ.",
"Camels are called \"ships of the desert\"because of the way they move not because of their transport capabilities.",
"Camels have three eyelids to protect themselves from blowing sand!",
"Canada is an Indian word meaning ''Big Village''.",
"Canada''s new flag, with its maple leaf design, was unfurled in 1965 in Ottawa!",
"Canola oil is actually rapeseed oil but the name was changed for marketing reasons!",
"Car accidents rise 10% during the first week of daylight savings time.",
"Car airbags kill 1 person for every 22 lives that they save.",
"Cashew nut shells contain oil that is extremely irritating to human skin.",
"Cast iron skillets used to be the leading source of iron in the American diet!",
"Castor oil is used as a lubricant in jet planes.",
"Cat urine glows under a black-light!",
"Caterpillars have over 2000 muscles.",
"Catgut comes from sheep not cats.",
"Cats cannot taste sweet things.",
"Cats have a peripheral vision of 285 degrees.",
"Cats make over 100 different vocal sounds; dogs can make about ten.",
"Cats sleep 16 to 18 hours per day.",
"Cats’ urine glows under a black light.",
"Cattle are the only mammals that pee backwards.",
"Cellophane is not made of plastic.  It is made from a plant fiber, cellulose, which has been shredded and aged.",
"Chained dogs are 3 times more likely to bite than unchained dogs.",
"Che Guevara suffered from asthma!",
"Check your map!  The Pacific entrance of the Panama Canal is farther East than the Atlantic entrance.",
"Check your map! Virginia extends farther west than West Virginia.",
"Cheetahs were raced at Romford greyhound stadium in 1937!",
"Chennai is now called the Detroit of India due to its automobile industry producing over 40% of the country's auto parts and vehicles.",
"Chewing gum while peeling onions will keep you from crying!",
"Chewing on gum while cutting onions can help a person from producing tears.",
"Children are more allergic to cockroaches than they are to cats!",
"Children are poisoned most frequently by eating harmful plants.",
"Children grow faster in the springtime than any other season during the year.",
"Children laugh about 400 times a day, while adults laugh on average only 15 times a day.",
"China has more English speakers than the United States.",
"China is the source of 70% of the worlds pirated goods.",
"Chop Suey was invented in New York!",
"Chop-suey is not a native Chinese dish, it was created in California by Chinese immigrants.",
"Chrysler built B-29''s that bombed Japan, Mitsubishi built Zeros that tried to shoot them down.  Both companies now build cars in a joint plant called Diamond Star.",
"Cinematon (1978) is a 152-hour long experimental film by French director Gerard Courant. It is considered to be the longest film ever released.",
"City dwellers have longer, thicker, denser nose hairs than country folks do.",
"Clinophobia is the fear of beds!",
"Clocks made before 1660 had only one hand - an hour hand.",
"Club Direct, a travel insurance company in Britain, provides insurance plans for protection from falling coconuts.",
"Coca-Cola was the first soft drink to be consumed in outer space.",
"Coca-Cola''s ''Super Pure'' Dasani bottled water is just filtered tap water!",
"Coconuts kill more people in the world than sharks do. Approximately 150 people are killed each year by coconuts.",
"Coffee beans aren''t beans - they''re fruit pits.",
"Coffee is the largest item bought and sold next to Petrol.",
"Cold water weighs more than hot water.",
"Colgate faced a big obstacle marketing toothpaste in Spanish speaking countries. Colgate translates into the command \"go hang yourself.\"",
"Colgate''s first toothpaste came in a jar.",
"Common pesticides such as roach, termite, and flea insecticide can be found in the bodies of majority of Americans.",
"Connecticut and Rhode Island never ratified the 18th Amendment (Prohibition).",
"Construction of the Taj Mahal began in 1632 one year after her death of his wife Mumtaz.",
"Contrary to popular belief, dogs do not only sweat by salivating.  They also sweat through the poors on their feet.",
"Contrary to popular belief, hair does not grow back darker and thicker after it has been shaved.",
"Contrary to popular belief, lightning travels from the ground upwards not from the sky downwards.",
"Contrary to popular belief, London Broil is not a cut of beef but rather a method of cooking.",
"Contrary to popular belief, opossums, squirrels, chipmunks, and mice do not carry rabies.",
"Contrary to popular belief, putting sugar in a car''s gas tank will NOT ruin its engine.",
"Contrary to popular belief, the first ironclad warships were built by Korea in the 16th century.",
"Contrary to popular belief, there are almost no Buddhists in India, nor have there been for about a thousand years.",
"Contrary to popular beliefs, chocolate does not cause acne.",
"Cow is a Japanese brand of shaving foam.",
"Cranberries are sorted for ripeness by bouncing them; a fully ripened cranberry can be dribbled like a basketball.",
"Crayola is a French word that means ''Oily chalk.",
"Crocodile babies don't have sex chromosomes; the temperature at which the egg develops determines gender.",
"Crocodiles are colour blind.",
"Crocodiles swallow stones to help them dive deeper.",
"Crushed cockroaches can be applied to a stinging wound to help relieve the pain.",
"Dandelion root can be roasted and ground as a coffee substitute.",
"Dating back to the 1600''s, thermometers were filled with Brandy instead of mercury.",
"Deep Breathing gives you health benefits similar to aerobics.",
"Dennis Ritchie \"offically\"created the C programming language while working at Bell labs.",
"Despite the hump, a camel''s spine is straight.",
"Diamonds mined in Brazil are harder than those found in Africa.",
"Diet Pepsi was originally called Patio Diet Cola.",
"Dirty snow melts faster than clean.",
"Discovery channel was started on June 17 198",
"Distributor: Buena Vista",
"Dogs and cats consume over $11 billion worth of pet food a year!",
"Dogs and cats, like humans, are either right or left handed... or is that paws?!",
"Dogs can hear sounds that you cant!",
"Dolphins nap with one eye open.",
"Dolphins sleep with one eye open!",
"Domestic cats hate lemons or other citrus scents.",
"Donkeys are commonly used by the Iraqi Military to launch rockets!",
"Donkeys kill more people annually than plane crashes.",
"Douglas Engelbart (invented computer mouse) was awarded the 1997 Lemelson-MIT Prize of $500000 the world's largest single prize for invention and innovation.",
"Dragonflies can travel up to 60 mph.",
"Dragonflies have six legs but cannot walk!",
"Dragonfly eye contains 30000 lenses.",
"Dreamt is the only English word that ends in the letters mt",
"Drew Carey once worked at a Denny''s.",
"Drivers kill more deer than hunters.",
"Ducks will only lay eggs early in the morning.",
"Due to gravitational effects, you weigh slightly less when the moon is directly overhead.",
"DUEL (1971) was the first feature film directed by Steven Spielberg and was written by Richard Matheson based on his own short story.",
"Dueling is legal in Paraguay, as long as both parties are registered blood donors.",
"Duracell, the battery-maker, built parts of its new international headquarters using materials from its own waste.",
"During a typical human life span, the human heart will beat approximately 2.5 billion times.",
"During his lifetime, artist Vincent Van Gogh only sold one of his paintings.",
"During his lifetime, Herman Melville''s Moby Dick sold only 50 copies.",
"During his or her lifetime, the average human will grow 590 miles of hair.",
"During menstruation, the sensitivity of a woman''s middle finger is reduced.",
"During the 1600''s, boys and girls in England wore dresses until they were about seven years old.",
"During the Gold Rush in 1849, some people paid as much as $100 for a glass of water!",
"During World War II, Uncle Ben''s was the exclusive supplier of rice to the U.S. Armed Forces.",
"During WWII, because a lot of players were called to duty, the Pittsburgh Steelers and Philadelphia Eagles combined to become The Steagles.",
"During your lifetime, you''ll eat about 60,000 pounds of food, that''s the weight of about 6 elephants!",
"During your lifetime, you''ll eat about 60,000 pounds of food, that''s the weight of about 6 elephants.",
"Each 5 m.p.h. you drive over 60 m.p.h. is like paying an additional $.10 a gallon for gas!",
"Each day is longer than the previous on by 0.00000002 seconds which is 13 seconds each century!",
"Each day, more than $40 Trillion Dollars changes hands worldwide.",
"Each day, up to 150 species of life become extinct.",
"Each nostril of a human being register smell in a different way. Smells that are made from the right nostril are more pleasant than the left.",
"Each year 96 billion pounds of food is wasted in the U.S.",
"Each year, 30,000 people are seriously injured by exercise equipment.",
"Each year, approximately 250,000 American husbands are physically attacked and beaten by their wives.",
"Each year, more than 50,000 people are injured by jewelry in the U.S.",
"Each year, the average family uses about 18,000 gallons of water just to do its laundry!",
"Eagles mate while airborne.",
"Early Romans used to use porcupine quills as toothpicks.",
"Ears of corn always have an even number of rows of kernels.",
"Earth's Circumference between the North and South Poles: 248582 miles (40008 km)",
"Eddie Cochran''s last recording before he died was Three Steps to Heaven!",
"Eighty percent of Americans will be the victim of violent crime at least once in their lifetime.",
"Electricity doesn't move through a wire but through a field around the wire.",
"Elephants are the only animals that can''t jump.",
"Elephants are the only animals that can’t jump.",
"Elephants, lions, and camels roamed Alaska 12,000 years ago.",
"Elvis Presley got a ''C'' in his eighth grade music class.",
"Emile Berliner invented the microphone in 187",
"Emus and kangaroos cannot walk backwards.",
"Energy is being wasted if a toaster is left plugged in after use.",
"English novelist Arnold Bennet drank a glass of water in a Paris Hotel to prove it was safe. He died two months later of Typhoid!",
"Enrico Caruso and Roy Orbison were the only tenors this century capable of hitting e over high c!",
"Ernest Vincent Wright wrote a novel, Gadsby, which contains over 50,000 words -- none of them with the letter E!",
"Eskimo ice cream is neither icy, or creamy!",
"Eskimos don''t gamble.",
"Europe is the only continent without a desert.",
"Even a small amount of alcohol placed on a scorpion will make it go crazy and sting itself to death.",
"Even Antarctica has an area code.  It’s 672.",
"Even though lionesses make the hunt they eat the prey only after the males have had their full. The cubs eat after the lionesses.",
"Everton FC used to be called St Domingo''s FC!",
"Every 45 seconds, a house catches on fire in the United States!",
"Every Alaskan citizen over the age of 6 months receives an oil dividend check of about $1000 per year!",
"Every day 400000 babies are born and 140000 people die.",
"Every day, the average person swallows about a quart of mucous.",
"Every hour one billion cells in the body must be replaced.",
"Every living thing on the Earth contains carbon.",
"Every second, Americans collectively eat one hundred pounds of chocolate",
"Every three seconds, a new baby is born.",
"Every time you lick a stamp, you''re consuming 1/10 of a calorie!",
"Every U.S. president with a beard has been a Republican.",
"Every workday, 6.7 million people commute to Manhattan!",
"Every year, Alaska has about 5,000 earthquakes.",
"Every year, kids in North America spend close to half a billion dollars on chewing gum!",
"Expansion of NASA is National Aeronautics and Space Administration and was established on July 29 195",
"Extremely high pressured water can easily cut through a steel beam.",
"Famous billionaire Howard Hughes stored his own urine in large bottles.",
"Famous lyricist \"Vairamuthu\"was born on 13-July-1953. He received the National Award 5 times in his career so far.",
"Farmers in England are required by law to provide their pigs with toys!",
"Fathers tend to determine the height of their child mothers their weight.",
"Fear of 'heights' is called as 'Acrophobia'.",
"Fear of blood is called as 'Hemaphobia'.",
"February 1865 is the only month in recorded history not to have a full moon.",
"February 1865 is the only month in recorded history to not have a full moon.",
"Female canaries cannot sing.",
"Females learn to talk earlier, use sentences earlier, and learn to read more quickly than males.",
"FIFA 2006 World Cup: Italy won their fourth world crown in Germany beating France on penalties in Berlin on 09 July 200",
"Fifteen people are known to have been crushed to death tilting vending machines towards them in the hope of a free can of soda.",
"Fine-grained volcanic ash can be found as an ingredient in some toothpastes.",
"Fingernails grow fastest on the hand you favor.",
"Fingernails grow nearly 4 times faster than toenails!",
"Fingernails grow nearly 4 times faster than toenails.",
"First four countries to have television:  England, the U.S., the U.S.S.R., and Brazil.",
"First-cousin marriages are legal in Utah, so long as both parties are 65 or older!",
"Fish have been on the earth for more than 450 million years.",
"Flamingos can only eat with their heads upside down.",
"Flamingos pee on their legs to cool themselves off.",
"Fleas can accelerate 50 times faster than a space shuttle.",
"Florida has more tornados per square mile than any other state.",
"Flu shots only work about 70% of the time.",
"Flying from London to New York by Concord due to the time zones crossed you can arrive 2 hours before you leave.",
"Flys always launch backwards for a quick getaway.",
"Food can only be tasted if it is mixed with saliva.",
"For beer commercials, they add liquid detergent to the beer to make it foam more.",
"For every ''normal'' webpage, there are five porn pages.",
"For every gallon of sea water, you get more than a quarter pound of salt.",
"For people that are lactose intolerant, chocolate aids in helping milk digest easier.",
"Forensic scientists can determine a person's sex, age, and race by examining a single strand of hair.",
"Forest fires move faster uphill than downhill.",
"Former U.S. President Franklin Pierce was arrested during his term as President for running over an old lady with his horse, but the charges were later dropped.",
"Fortune cookies were actually invented in America, in 1918, by Charles Jung!",
"Forty percent of Americans have never visited a dentist.",
"French was the official language of England for over 600 years.",
"Frogs cannot swallow without blinking.",
"Frogs sometimes eat enough fireflies that they themselves glow.",
"From a complete stop, a human is capable of outrunning a Formula One Racecar for about 30 feet!",
"From the age of thirty, humans gradually begin to shrink in size.",
"Frozen lobsters can come back to life when thawed!",
"Gardening is said to be one of the best exercises for maintaining healthy bones.",
"George W. Bush born July 6 194",
"George Washington and Thomas Jefferson grew marijuana on their plantations!",
"George Washington grew marijuana in his garden.",
"German chemists made a replica of a trophy the size of one molecule.",
"Germany and Brazil are the two countries with most appearances in a World Cup final. (7 times)",
"Giant Panda Bears give birth to a 4 ounce Baby Panda!",
"Giraffes are unable to cough.",
"Girls have more tastebuds than boys.",
"Given the opportunity, deer will chew gum and marijuana.",
"Gloucestershire airport in England used to blast Tina Turner songs on the runways to scare birds away.",
"Gmail was launched as an invitation-only beta release on April 1 2004 and it became available to the general public on February 7 200",
"Goat''s milk is used more widely throughout the world than cow''s milk.",
"Goats do not have upper front teeth.",
"Gold leaf is attached to paper or plaster with egg whites, the same now as in ancient times!",
"Gold never erodes.",
"Goldfish cant close their eyes.",
"Goldfish lose their color if they are kept in dim light or are placed in a body of running water, such as a stream.",
"Goldfish remember better in cold water than warm water.",
"Goodyear Rubber Company researched and concluded that shoes wear out faster on the right foot than the left.",
"Google consists of over 450000 servers racked up in clusters located in data centers around the world.",
"Google's name is a play on the word googol which refers to the number 1 followed by one hundred zeroes.",
"Google.com - After entering search keyword On clicking 'I'm feeling lucky' button it will open the first result's website directly.",
"Grapes explode when you put them in the microwave.",
"Grapes explode when you put them in the microwave.",
"Grenades were invented in China over 1,000 years ago.",
"Greyhounds have the best eyesight of any breed of dog.",
"Half of all Americans over the age of 55 have no teeth.",
"Half of all identity thieves are either relatives, friends, or neighbors of their victims.",
"Halifax, Nova Scotia, Canada has the most bars per capita than anywhere else in the world.",
"Halle Berry’s stunt double, in the movie “Catwoman”, is a man.",
"Harrison Ford has a species of spider named after him!",
"Harrods have three private wells to supply their water!",
"Harry S. Truman was the last U.S. President with no college degree.",
"Height of the Great pyramid of Giza is 1375 metres (4522 ft).",
"Heineken beer is designed to ''foam'' for exactly five minutes.",
"Henry Ford produced the model T only in black because the black paint available at the time was the fastest to dry.",
"Henry Ford was Charles Lindbergh''s first passenger in the Spirit of St. Louis.",
"Henry Ford, father of the Automobile, is also father of the charcoal briquette.",
"Highest Temperature Recorded: 138°F - Al Aziziyah Libya September 13 1922 (57°C)",
"Hilton was the first international hotel chain.",
"Hippopotamuses are born under water.",
"Hiroshima bombed by \"Col. Paul Tibbets\"on August 6 1945 at 8:15 A.M. local time.",
"Honey is the only food that will not spoil.",
"Honey is used sometimes for antifreeze mixtures and in the center of golf balls.",
"Honeybees have a type of hair on their eyes!",
"Hong Kong has more Rolls Royces per person than anywhere else in the world.",
"Honolulu is the only place in the United States that has a royal palace!",
"Honolulu is the only place in the United States that has a royal palace.",
"Houdini was the first man to fly a plane solo in Australia.",
"Household bleach is the recommended chemical to decontaminate people exposed to the anthrax virus, by the U.S. F.D.A. .",
"How does a shark find fish?  It can hear their hearts beating.",
"However they cannot sub if a player has been sent off with a red card.",
"Human birth control pills work on gorillas.",
"Human teeth are almost as hard as rocks!",
"Human thigh bones are stronger than concrete!",
"Humans blink over 10,000,000 times a year!",
"Hummingbirds can weigh less than a penny!",
"Hummingbirds can''t walk.",
"Hummingbirds can't walk.",
"Hyenas regularly eat the feces of other animals!",
"Hypnotism is banned by public schools in San Diego.",
"Iceland consumes more Coca Cola than any other country.",
"Iceland has no railway system or army!",
"ICICI Bank (formerly Industrial Credit and Investment Corporation of India) was incorporated at the initiative of World Bank in 195",
"Identical twins do not have identical fingerprints.",
"Identify a fake:  The second hand on an authentic Rolex watch doesn''t tick, it moves smoothly.",
"Identity crisis?  About 10% of Jewish households have Christmas Trees.",
"If a car is travelling at 55 miles per hour it will travel 56 feet before the driver can shift his foot from the accelerator to the brake.",
"If a Lobster loses an eye, it will grow another one.",
"If a new player takes more than 3 minutes to be ready to face or be ready for his partner to face the next delivery after the previous batsman was ruled out then the new player is given timed-out in cricket.",
"If a surgeon in Ancient Egypt lost a patient while performing an operation, his hands were cut off.",
"If China imported just 10% of it''s rice needs- the price on the world market would increase by 80%.",
"If it isn’t moving a frog can’t see it.  If the frog can’t see it, he won’t eat it.",
"If Manhattan had the same population density as Alaska, there would only be 15 people living there.",
"If the chemical sodium is dropped into water it will immediately and violently explode.",
"If the population of China walked past you in single file, the line would never end because of the rate of reproduction.",
"If Wal-Mart was classified as a country, it would be the 24th most productive country in the world.",
"If water in our body is reduced by 10% we will die.",
"If you are bitten by a poisonous snake, and fail to receive medical attention, you still have a 50% chance of survival.",
"If you are locked in a completely sealed room, you will die of carbon dioxide poisoning first before you will die of oxygen deprivation.",
"If you counted 24 hours a day, it would take 31,688 years to reach one trillion!",
"If you cut a ''V'' shape into your toe nails, you can prevent ''in-grown'' toe nails.",
"If you flip a coin ten times, the odds against its coming up with the same side showing each time are 1,023 to 1.",
"If you put a raisin in a fresh glass of champagne, it will rise and fall continuously.",
"If you shake a can of mixed nuts, the larger ones will rise to the top.",
"If you took a standard slinky and stretched it out it would measure 87 feet.",
"If you toss a penny 10,000 times, it will not be heads 5,000 times, but more like 4,950.  The heads picture weighs more, so it ends up on the bottom.",
"If you unfolded your brain, it would cover an ironing board.",
"If you went out into space, you would explode before you suffocated because there''s no air pressure.",
"If you were to roll a lung from a human body and out flat it would be the size of a tennis court.",
"If you yelled for 8 years, 7 months and 6 days, you would have produced enough sound energy to heat one cup of coffee.",
"If your skin is laid flat it will cover an area of 18 square feet.",
"If your stomach didn''t produce a new layer of mucous every two weeks, it would digest itself.",
"If you’re over 100 years old, there’s an 80% chance you’re a woman.",
"Iguanas have two penises!",
"In 1659, it was illegal to celebrate Christmas in Massachusetts.",
"In 1789, the total U.S. federal government debt was $190,000.",
"In 1895 Hampshire police handed out the first ever speeding ticket, fining a man for doing 6mph!",
"In 1897, Bayer, who is the maker of Aspirin, marketed the drug heroin.",
"In 1910 football teams were penalized 15 yards for an incompleted forward pass.",
"In 1954, Bob Hawke was immortalized by the Guinness Book of Records for chugging 2.5 pints of beer in 12 seconds.",
"In 1956, 80% of all U.S. households had a refrigerator, but only 8% of British households had one!",
"In 1976 an LA secretary named Jannene Swift officially married a 50 pound rock in a ceremony witnessed by more than 20 people.",
"In 1980, a Las Vegas hospital suspended workers for betting on when patients would die!",
"In 1980, the city of Detroit presented Saddam Hussein with a key to the city.",
"In 1982, a high school student from Los Angeles, California unscrambled the Rubik''s Cube in 22.95 seconds.",
"In 1987 American Airlines saved $40,000 by eliminating one olive from its First Class salads.",
