"'Barack Obama' born August 4 1961 is the 44th and current President of the United States.",
"'Canberra' is the capital of 'Australia'.",
"'Coast Redwood' tree is the world's tallest tree. (371 ft) in Redwood National Park California United States)",
"'Dina Thanthi' was founded by S. P. Adithanar a lawyer trained in Britain and practised in Singapore with its first edition from Madurai in 194",
"'High Street Phoenix' in mumbai is the india's largest shopping mall with 3300000 sq ft whereas 'Express Avenue (Royapettah Chennai / Under construction)' will be the largest in south india with '1500000 sq ft'.",
"'Jana Gana Mana' was officially adopted by the Constituent Assembly as the Indian national anthem on January 24 195",
"'Katharine Hepburn' has won four OSCAR awards more than any actor in film industry.",
"'King Cobra' is the National Reptile of India.",
"'Mango' is india's national fruit.",
"'Mother India' (1957) was the first indian film to be nominated in Oscars in the best Foreign film category.",
"'Mudskipper' fish can use their pectoral fins to walk on land.",
"'Mumbai' is called as the 'Business Capital' of India.",
"'Nitrous Oxide' is called as Laughing Gas.",
"'Skype Limited' was founded in 2003 by Swedish-born entrepreneur Niklas Zennström and the Dane Janus Friis.",
"'South China Sea' is the largest sea in the world (2974600 sq km)",
"'Sri Dalada Maligawa' temple in Kandy Sri Lanka also be called as “The temple of the teeth”. Kumarasami Kamaraj was born on 15-July-1903 and was chief minister of Tamil Nadu during 1954-196",
"'Vinoo Mankad' is the only indian cricket player to bat in all positions (1 to 11).",
"-40 degrees Celsius is equal to -40 degrees Fahrenheit.",
"1 plain milk chocolate bar has more protein than a banana.",
"1 square inch of human skin contains 625 sweat glands.",
"10 of the tributaries flowing into the Amazon river are as big as the Mississippi river.",
"10 percent of the Russian government''s income comes from the sale of vodka.",
"11% of people are left handed.",
"15 million gallons of wine were destroyed in the 1906 San Francisco earthquake.",
"15 percent of Americans secretly bite their toes.",
"160 cars can drive side by side on the Monumental Axis in Brazil, the world''s widest road.",
"17% of Intel employees are Indians.",
"2 out of 3 adults in the United States have hemorrhoids.",
"2,500 newborn babies will be dropped in the next month.",
"20% of tuxedo rentals take place in May.",
"20252 is Smokey the Bear''s own zip code.",
"22-May-1990 Microsoft launched \"Windows 0\"O/s.",
"23% of all photocopier faults worldwide are caused by people sitting on them and photocopying their butts.",
"25% of your bones are located in your feet.",
"34% of Microsoft employees are Indians.",
"35,000 people in the U.S. will die from the flu annually.",
"36% of NASA employees are Indians.",
"38% of doctors in America are Indians.",
"4.5 pounds of sunlight strike the Earth each day.",
"40% of all indigestion remedies sold in the world are bought by Americans.",
"40% of women have hurled footwear at a man.",
"41% of the moon is not visible from earth at any time.",
"50% of U.S. pizzas are sold with pepperoni on them.",
"68 percent of a Hostess Twinkie is air!",
"7,000 new insect species are discovered every year.",
"7-11 sells 10,000 pots of coffee an hour, every hour, every day.",
"75% of Honda vehicles purchased in the U.S. are manufactured in North America!",
"76% of Americans celebrate New Year''s Eve in groups of less than 20.",
"80% of 10 year old girls in the U.S. go on a diet.",
"80% of millionaires drive used cars.",
"80% of Publishers'' Clearing House $10 million winners did not purchase any magazine subscriptions!",
"84% of a raw apple is water.",
"85% of all Valentine''s Day cards are purchased by women!",
"85% of movie actors earn less than $5,000 a year from acting!",
"9 out of 10 lightning strike victims survive!",
"90 percent of women who walk into a department store immediately turn to the right.",
"90% of all restaurants fail during their first year of operation.",
"97% of all paper money in the US contains traces of cocaine.",
"99% of people cannot lick their elbow.",
"9th century chemist Jabir ibn Hayyan (known as \"Geber\"in Europe) is considered as \"Father of chemistry\".",
"\"Liberty Enlightening the World\"is the official name of \"Statue of Liberty\".",
"\"Mobira Senator\"is the first mobile phone model launched by Nokia in 198",
"A ''face-off'' in hockey was originally called a ''puck-off''.",
"A ''jiffy'' is an actual unit of time for 1/100th of a second!",
"A ''jiffy'' is an actual unit of time for 1/100th of a second",
"A 100-pound person on Earth would weigh 38 pounds on Mars.",
"A B-25 bomber airplane crashed into the 79th floor of the Empire State Building on July 28, 1945.",
"A baboon called Jackie became a private in the South African army in World War I.",
"A baby eel is called an elver, a baby oyster is called a spat.",
"A baby octopus is about the size of a flea at birth.",
"A ball of glass will bounce higher than a ball made of rubber.",
"A bird ''chews'' with its stomach.",
"A blue whale''s aorta (the main blood vessel) is large enough for a human to crawl through.",
"A blue whale''s heart is the size of a Volkswagen Beetle!",
"A Boeing 747 airliner holds 57,285 gallons of fuel!",
"A Boeing 747 airliner holds 57,285 gallons of fuel.",
"A broken clock is always right twice a day.",
"A car operates at maximum economy, gas-wise, at speeds between 25 and 35 miles per hour.",
"A car traveling 100 mph would take more than 29 million years to reach the nearest star.",
"A cesium atom in an atomic clock beats over nine billion times a second.",
"A Chameleons tongue is twice the length of its body.",
"A chameleon’s tongue is twice the length of its body.",
"A chance of a woman having twins is increased after the age of 35. About 1 in 27 women will give birth to twins after this age. After 50 the chances of having twins is 1 in 9.",
"A chicken will lay bigger and stronger eggs if you change the lighting in such a way as to make them think a day is 28 hours long!",
"A chimpanzee can learn to recognize itself in a mirror.",
"A Citreon 2CV with an oil leak once travelled 500 miles through Italy after its gearbox was filled with bananas!",
"A cockroach can live several weeks with its head cut off - it dies from starvation!",
"A coffee tree yields about one pound of coffee in a year.",
"A comet''s tail always points away from the sun.",
"A company in Taiwan makes dinnerware out of wheat, so you can eat your plate!",
"A company in Taiwan makes dinnerware out of wheat, so you can eat your plate.",
"A completely blind chameleon will still take on the colors of its environment.",
"A cow gives nearly 200,000 glasses of milk in her lifetime.",
"A cricket pitch is a rectangular area of the ground 22 yards (20 m) long and 10 ft (0 m) wide.",
"A crocodile always grows new teeth to replace the old teeth!",
"A crocodile's digestive juices are so strong that it can digest a steel nail.",
"A cubic yard of air weighs about 2 pounds at sea level.",
"A dime has 118 ridges around the edge, a quarter has 119.",
"A dragonfly has a lifespan of 24 hours.",
"A female 'Rabbit'is called 'Doe'.",
"A female whale is called a 'Cow'.",
"A fetus develops fingerprints at eighteen weeks!",
"A fire in Australia has been burning for more than 5,000 years!",
"A full-grown bear can run as fast as a horse.",
"A fully loaded supertanker traveling at normal speed takes a least twenty minutes to stop.",
"A giraffe can clean its ears with its 21-inch tongue!",
"A Giraffe has the same number of bones in its neck as a man.",
"A group of chicken is called a flock.",
"A group of crows can be called as 'Murder'.",
"A group of dogs is called a \"Kennel\".",
"A group of fish is called a school shoal draft run haul or catch.",
"A group of frogs is called an army.",
"A group of geese on the ground is a gaggle, a group of geese in the air is a skein!",
"A group of kangaroos is called a mob.",
"A group of officers is called a mess.",
"A group of rats is called as 'Colony'.",
"A hard working adult sweats up to 4 gallons per day. Most of the sweat evaporates before a person realizes it''s there, though!",
"A hard working adult sweats up to 4 gallons per day.",
"A hardboiled egg will spin.  An uncooked or softboiled egg will not.",
"A hedgehog''s heart beats 300 times a minute on average!",
"A hedgehog''s heart beats 300 times a minute on average.",
"A hippo can open its mouth wide enough to fit a 4 foot tall child inside!",
"A honeybee's top speed is 24kph (15mph)",
"A humming bird flaps its wings up to 90 times a second (5400 times a minute)",
"A jellyfish is 95 percent water",
"A jiffy is an actual unit of time for 1/100th of a second. Thus the saying, I will be there in a jiffy.",
"A kangaroo cannot jump if its tail is off the ground.",
"A killer whale’s heart beats 30 times a minute under water, 60 times a minute on the surface.",
"A Koala Bear sleeps 22 hours of every day.",
"A lady's heart beats faster than man's.",
"A lightning bolt generates temperatures five times hotter than those found at the sun''s surface!",
"A lion''s roar can be heard from more than five miles away.",
"A lump of pure gold the size of a matchbox can be flattened into a sheet the size of a tennis court!",
"A lump of pure gold the size of a matchbox can be flattened into a sheet the size of a tennis court.",
"A male baboon can kill a leopard.",
"A male cat is called 'Tom' and a female is called as 'Queen'.",
"A man gets robbed in London every 4.5 minutes! (and he is getting fed up of it)",
"A man named Charles Osborne had the hiccups for 69 years!",
"A man named Charles Osborne had the hiccups for approximately sixty-nine years.",
"A man once sued his doctor because he survived his cancer longer than the doctor predicted.",
"A marine catfish can taste with any part of its body.",
"A mile on the Ocean and a mile on Land are not the same distance. Land (5280 feet) and Ocean (6080 feet).",
"A million dollars'' worth of $100 bills weighs only 22 pounds!",
"A mole can dig a 300 feet long tunnel in just one night!",
"A mole can dig a hole 300 feet deep in one night.",
"A mole can dig a tunnel 300 feet long in just one night!",
"A moth has no stomach.",
"A nest of young puppies is called as 'Liter'.",
"A one ounce milk chocolate bar has 6 mg of caffeine.",
"A peanut is not a nut.  It is a legume.",
"A person infected with the SARS virus, has a 95-98% chance of recovery.",
"A person swallows approximately 295 times while eating dinner.",
"A person will burn 7 percent more calories if they walk on hard dirt compared to pavement.",
"A pig''s penis is shaped like a corkscrew.",
"A pipe 2 feet in diameter will allow four times more fluid to pass through it than a pipe 1 foot in diameter.",
"A polar bear''s skin is black. Its fur is not white, but actually clear.",
"A pound of potato chips costs 200 times more than a pound of potatoes.",
"A pregnant goldfish is called a Twit.",
"A quarter has 119 grooves on its edge, a dime has one less groove!",
"A queen bee uses her stinger only to sting another queen bee.",
"A rainbow can only be seen in the morning or late afternoon.",
"A raindrop is round but appears to be oval because gravitation pulls on the front of the raindrop as it is falling.",
"A rat can fall from a five story building without injury.",
"A rat can go without water longer than a camel can.",
"A real estate agent’s rule of thumb:  To estimate what a house will sell for, ask the owner what its worth and subtract 10%.",
"A recent study at Harvard has shown that eating chocolate can actually help you live longer!",
"A roach can live up to nine days without its head.",
"A rodent''s teeth never stop growing.",
"A Russian man who wore a beard during the time of Peter the Great had to pay a special tax.",
"A Saudi Arabian woman can get a divorce if her husband doesn't give her coffee.",
"A shrimp''s heart is in its head.",
"A single 'RYE' plant can spread up to 400 miles of roots underground.",
"A single cup of gasoline, when ignited, has the same explosive power as five sticks of dynamite.",
"A small airplane can fly backwards.",
"A snail can sleep for three years.",
"A sneeze can travel as fast as 100 miles per hour.",
"A sneeze travels out your mouth at over 100 m.p.h.!",
"A solar eclipse occurred on July 22 2009 was the longest during the 21st century and it lasted a maximum of 6 minutes and 39 seconds.",
"A species of earthworm in Australia grows up to 10 feet in length.",
"A spider''s silk is stronger than steel.",
"A survey reported that 12% of Americans think that Joan of Arc was Noah''s wife.",
"A toaster uses almost half as much energy as a full-sized oven.",
"A toothbrush within 6 feet of a toilet can get airborne bacteria from flushing.",
"A toothpick is the object most often choked on by Americans!",
"A toothpick is the object most often choked on by Americans.",
"A tuna fish can swim 100 miles in a single day!",
"A typical bed usually houses over 6 billion dust mites.",
"A violin contains about 70 separate pieces of wood!",
"A volcano has enough power to shoot ash as high as 50 km into the atmosphere.",
"A woman''s sense of smell is most sensitive during ovulation.",
"A woodpecker can peck 20 times a second.",
"A woodpecker can peck twenty times a second.",
"A world record was set in 1990 when a solar powered aircraft flew 4060km across the USA using no fuel.",
"A young fish can be called as 'Fry'.",
"A young hen is called as 'Pullet'.",
"A. P. J. Abdul Kalam born 15 October 1931 in Rameshwaram.",
"A. S. Dileep Kumar was born 6 January 1966 and then converted to Islam in the year 1989 at the age of 23 and changed his name to 'Allah Rakha Rahman' (A.R.Rahman).",
"About 1 in 30 people in the U.S. are in jail, on probation, or on parole.",
"About 1 in 30 people, in the U.S., are in jail, on probation, or on parole!",
"About 10% of U.S. households pay their bills in cash.",
"About 2/3 of American men prefer boxers to briefs.",
"About 20% of all volcanoes are under water.",
"About 3000 years ago, most Egyptians died by the time they were 30!",
"About 39,000 gallons of water are used to produce the average car!",
"About 400 different kinds of microbes live on and in the human body.",
"About half of all Americans are on a diet on any given day.",
"About twenty-five percent of the population sneeze when they are exposed to light.",
"According to an age old custom, carrying a dead shrew in your pocket wards off rheumatism!",
"According to an old English system of time units a moment is one and a half minutes.",
"According to an old English system of time units a moment is one and a half minutes.",
"According to Gaming Law, casinos have to stock enough cash to cover all the chips on the ''floor''.",
"According to legend, there’s a Superman in every episode of Seinfeld.",
"According to scientific studies, a rat''s performance in a maze can be improved by playing music written by Mozart.",
"According to studies, men change their minds two to three times more often than women.",
"According to U.S. FDA standards, 1 cup of orange juice is allowed to contain 10 fruit fly eggs, but only 2 maggots.",
"According to U.S. laws, a beer commercial can never show a person actually drinking beer.",
"Acorns were used as a coffee substitute during the American Civil War.",
"Actor John Wayne made more than 200 movies.",
"Actor Mark Wahlberg has a third nipple!",
"Actor Val Kilmer grew up on Roy Rogers'' ranch.",
"Actress Meryl Streep holds the record for the most Oscar nominated actress with a record of 13 nominations.",
"Adult movie star, Ron Jeremy, has a master''s degree in Special Education.",
"After eating, a housefly regurgitates its food and then eats it again!",
"Airports that are at higher altitudes require a longer airstrip due to lower air density.",
"Al Capone died in prison from syphillis - despite being the first sufferer to be treated with antibiotics!",
"Al Capone''s business card said he was a used furniture dealer.",
"Albert Einstein was offered the presidency of Israel in 1952, but he declined.",
"Albert Einstien never wore any socks.",
"Alexander the Great and Julius Caesar were both epileptic.",
"Alfred Hitchcock didn''t have a belly button.",
"All babies are color blind when they are born.",
"All clams start out as males; some decide to become females at some point in their lives.",
"All coffee is grown within 1,000 miles of the equator.",
"All Humans Are 99.9% Genetically Identical and 98.4% of human genes are the same as the genes of a chimpanzee.",
"All major league baseball umpires must wear black underwear while on the job!",
"All of the clocks in the movie 'Pulp Fiction' are fixed to 4:2",
"All of the Earth''s continents are wider at the north than in the south - and nobody knows why.",
"All polar bears are left handed",
"All species of beetles are edible.",
"All the gold ever mined could be molded into a cube 60 feet high and 60 feet wide.",
"All the pet hamsters in the world are descended from a single wild golden Hamster found in Syria in 1930!",
"All the platinum ever mined would fit into an average-sized living-room!",
"All the swans in England are property of the Queen.",
"Allen Hill took the first wicket in test cricket when he dismissed Nat Thomson for ",
"Almonds are a member of the peach family.",
"Almost all varieties of breakfast cereals are made of grass.",
"Aluminum used to be more valuable than gold!",
"America once issued a 5-cent bill!",
"Americans are responsible for generating roughly 20% percent of the garbage in the world.",
"Americans collectively eat one hundred pounds of chocolate every second.",
"Americans did not commonly use forks until after the Civil War.",
"Americans eat nearly 100 acres of pizza every day - that''s approximately 350 slices per second!.",
"Americans spend more than 5.4 billion dollars on their pets each year!",
"Americans will spend more on cat food this year than baby food.",
"Among older men, vanilla is the most erotic smell.",
"An ''aglet'' is the plastic or metal tip of a shoelace.",
"An adult giraffe''s tongue is 17 inches long.",
"An airplane mechanic invented Slinky while he was playing with engine parts and realized the possible secondary use for the springs.",
"An albatross can sleep while it flies!",
"An American urologist once bought Napoleon''s penis for $40,000.",
"An apple, potato, and onion all taste the same if you eat them with your nose plugged.",
"An average adult produces about half a liter of flatulent gas per day, resulting in an average of about fourteen occurrences of flatulence a day.",
"An average person eat 60000 pounds of food in his lifetime.",
"An average person spent 24 years of his life in sleeping.",
"An average woman consume 6 lbs (72 kg). of lipstick in her lifetime.",
"An eagle can attack, kill, and carry away an animal as large as a small deer.",
"An earthquake on Dec. 16, 1811 caused parts of the Mississippi River to flow backwards!",
"An earthquake on Dec. 16, 1811 caused parts of the Mississippi River to flow backwards.",
"An egg will float if placed in water in which sugar has been added.",
"An elephant trunk has no bone but 40,000 muscles.",
"An elephant''s tooth can weigh as much as 12 pounds.",
"An iceberg contains more heat than a lit match.",
"An olive tree can live up to 1,500 years!",
"An ostrich''s eye is bigger than its brain.",
"An ounce of platinum can be stretched 10,000 feet.",
"Ancient Egyptians slept on pillows made of stone!",
"Ancient Egyptians slept on pillows made of stone.",
"Ancient Romans at one time used human urine as an ingredient in their toothpaste.",
"and the viewers were never told!",
"Animals will not eat another animal that has been hit by a lightning strike!",
"Annually, the amount of garbage that is dumped in the world''s oceans is three times the weight of fish that is caught from the oceans.",
"Another name for a Microsoft Windows tutorial is ''Crash Course''!",
"Antarctica is the only land on our planet that is not owned by any country.",
"Anteaters prefer termites to ants.",
"Ants don''t sleep",
"Ants don’t sleep.",
"Any modern jet is capable of breaking the sound barrier.",
"Any space vehicle must move at a rate of 7 miles per second in order to escape the earth''s gravitational pull.",
"Aoccdrnig to a rscheearch procejt at Cmabrigde Uinervtisy, it deosnt mttaer waht oredr the ltteers in a wrod are, the olny iprmoatnt tihng is taht the frist and lsat ltteer be in the rghit pclae. Tihs is bcuseae the huamn mnid deos not raed ervey lteter b",
"Apple company was founded by Steve Jobs Steve Wozniak and Ronald Wayne on April 1 197",
"Apple seeds are poisonous!",
"Apples are 25% air.",
"Apples are actually part of the rose family.",
"Apples are more efficient than caffeine in keeping people awake in the morning.",
"Apples are more efficient than caffeine in keeping people awake in the mornings!",
"Approximately $25 million is spent each year on lap dances in Las Vegas.",
"Approximately 115 tons of ocean salt spray enters the earth''s atmosphere each second.",
"Approximately 25,000 workers died during the building of the Panama Canal, and approximately 20,000 of them contracted malaria and yellow fever.",
"Approximately 40% of the U.S. paper currency in circulation was counterfeit by the end of the Civil War.",
"Approximately 70 percent of the earth is covered by water.  Only 1 percent of this water is drinkable.",
"Approximately 70,000 people in the U.S. are both blind and deaf!",
"Approximately one-third of the population can''t snap their fingers!",
"Arctic ice is rapidly disappearing and the region may have its first completely ice-free summer by 2040 or earlier. Polar bears and indigenous cultures are already suffering from the sea-ice loss.",
"Area wise India is the 7th largest country in the world.",
"Armadillos can get leprosy.",
"Arnold Schwarzenegger’s voice, in the movie ''Hercules'', was dubbed.",
"Arthur Conan Doyle, author of the Sherlock Holmes stories, was an ophthalmologist by profession!",
"As of 26 May 2010 the human population of the world is estimated by the United States Census Bureau to be 682320000",
"Astronauts cannot burp in space.",
"Astronauts get taller when they are in space.",
"At  one ''feeding'', a mosquito can absorb one and a half times its own weight in blood.",
"At 120 miles per hour, a Formula One car generates so much downforce that it can drive upside down on the roof of a tunnel.",
"At 188 decibels, the whistle of the blue whale is the loudest sound produced by any animal",
"At age 18, the Queen of England was a mechanic for the British Military.",
"At age 70, more than 70 percent of men are still potent!",
"At birth, a panda bear is smaller than a mouse.",
"At horse race tracks, the favorite wins fewer than 30% of the time!",
"At room temperature, the average air molecule travels at the speed of a rifle bullet.",
"At their closest point, the Russian and U.S. borders are less than two miles apart.",
"Atilla the hun was a dwarf!",
"Attics were invented in Attica.",
"Australia''s Great Barrier Reef is 1,250 miles long!",
"Austria was the first country to use postcards.",
"Average distance from the Earth to the Sun: 93020000 miles (149669180 km)",
"Avocados are poisonous to birds.",
"Avocados have more protein than any other fruit.",
"Babe Ruth wore a cabbage leaf under his cap to keep him cool! He changed it every 2 innings!",
"Babe Ruth wore No. 3 because he batted third.",
"Babies are born without knee caps.",
"Babies start dreaming even before they''re born.",
"Babies that are breastfed are more likely to be slimmer as adults than those that are not breastfed.",
"Babies who wear disposable diapers are five times more likely to develop diaper rash than those that wear cotton diapers.",
"Babies'' eyes do not produce tears until the baby is approximately six to eight weeks old.",
"Baby beavers are called kittens.",
"Baby robins eat 14 feet of earthworms every day!",
"Baby robins eat 14 feet of earthworms every day.",
"Baby whales grow at an average rate of 10lbs per hour!",
"Bacteria that cause tooth decay, acne, tuberculosis, and leprosy can be cured with cashews.",
"Balsa wood is classified as a hard wood!",
"Bamboo plants can grow up to 36 inches in a day.",
"Bananas aren’t fruit! They are a type of herb.",
"Bananas contain a natural chemical which can make a person happy. This same chemical is also found in Prozac.",
"Banging your head against a wall uses 150 calories an hour.",
"Bank robber John Dillinger played professional baseball.",
"Barbie''s full name is Barbara Millicent Roberts.",
"Barbie's full name is Barbara Millicent Roberts.",
"Basketball great Wilt Chamberlain never fouled out of a game.",
"Baskin Robbins once made ketchup ice cream.",
"Bats always turn left when exiting a cave!",
"Bats always turn left when exiting a cave.",
"Beavers can swim half a mile underwater on one gulp of air.",
"Beavers have orange teeth!",
"Because heat expands the metal, the Eiffel Tower always leans away from the sun.",
"Because metal was scarce; the Oscars given out during World War II were made of plaster.",
"Beelzebub is Hebrew for ''Lord of the Flies''.",
"Betsy Ross was born with a fully formed set of teeth.",
"Bill Gates designed a traffic control system for Seattle when he was only 15!",
"Bill Gates'' house was designed using a Macintosh computer.",
"Billy goats urinate on their own heads to smell more attractive to females.",
"Black bears are not always black. They can be brown, cinnamon, yellow, and sometimes white.",
"Black Whales are born white.",
"Blaise Pascal worked on the calculator for three years between 1642 and 1645 called as 'Pascaline'.",
"Blood in animals and sap in plants is composed mainly of water.",
"Blue eyes are the most sensitive to light, dark brown the least sensitive.",
